{
  "schema_version": "1.0.0",
  "id": "02",
  "title": "Historical Buildings and Urban Geography",
  "dataset_ids": [
    "kt-modern-buildings",
    "kt-building-chronology-source",
    "kt-building-date-classification",
    "kt-historical-map-faces",
    "kt-map-matching-candidates",
    "kt-historical-observations",
    "kt-support-02"
  ],
  "citation": "Ayyar, Aryan (2026). Historical Buildings and Urban Geography. The Kai Tak Historical Research Archive, candidate v1.0.0, collection 02.",
  "file_count": 358,
  "permitted_bundle_files": 133,
  "release_manifest": "../../releases/v1.0.0/collections/02.json"
}
